{"$schema":"https://json-schema.org/draft/2020-12/schema","$id":"discovery-product-candidate.schema.json","type":"object","required":["source","source_role","source_identity","source_key","source_url","canonical_url","label_raw","label_hint","model_hint","source_categories","discovery_page","evidence_reference","locator","rule_version","warnings","review_status"],"properties":{"source":{"enum":["ep","gam"]},"source_role":{"enum":["authoritative_existence","supplemental"]},"source_identity":{"type":"string"},"source_key":{"type":"string"},"source_url":{"type":"string"},"canonical_url":{"type":"string"},"label_raw":{"type":"string"},"label_hint":{"type":"string"},"model_hint":{"type":["string","null"]},"source_categories":{"type":"array","items":{"type":"string"}},"discovery_page":{"type":"string"},"evidence_reference":{"type":"string"},"locator":{"type":"string"},"rule_version":{"type":"string"},"warnings":{"type":"array","items":{"type":"string"}},"review_status":{"enum":["pending","reviewed"]}},"additionalProperties":false}
