{"source":"gam","source_role":"supplemental","source_identity":"gam:url-v1:sha256:fixture","source_key":"url-v1:sha256:fixture","source_url":"/cl/carretilla-ep-123.html","canonical_url":"https://online.gamrentals.com/cl/carretilla-ep-123.html","label_raw":"EFL 181","label_hint":"EFL 181","model_hint":"EFL 181","source_categories":[],"discovery_page":"https://online.gamrentals.com/cl/826-ep","evidence_reference":"snapshots/run/gam/hash.html","locator":"a.product-miniature","rule_version":"gam-discovery-v1","warnings":[],"review_status":"pending"}
